{
  "schema_version": 1,
  "audit_id": "site_audit_a448e10561410e40",
  "app_id": "zhiyu_ai_hk",
  "fact_snapshot_id": "fact_snapshot_7c19e04928e8cc09",
  "collected_at": "2026-09-07T01:49:20Z",
  "collector_version": "site-audit-v1",
  "method": "公网 HTTP 实测、AI 爬虫 UA 探测、HTML 解析；CSR 仅做原始 HTML 启发式，不做浏览器渲染",
  "presence": {
    "website_or_shop_url": "https://app.zhiyu.hk",
    "owned_website_url": "https://www.zhiyu.hk/",
    "shop_url": null,
    "owned_website_kind": "owned_website",
    "shop_kind": null,
    "audit_eligible": true,
    "skip_reason": null
  },
  "request": {
    "url": "https://www.zhiyu.hk/",
    "brand": "知鱼",
    "sample_pages": 12,
    "url_override": true
  },
  "meta": {
    "target_url": "https://www.zhiyu.hk/",
    "final_home_url": "https://www.zhiyu.hk/",
    "requested_sample_pages": 12,
    "sampled_pages": 11,
    "successful_pages": 11
  },
  "data_quality": {
    "reliable": true,
    "warnings": [
      "发现的可采样 URL 不足：计划 12 页，实际 11 页",
      "浏览器渲染未执行；CSR 仅按原始 HTML 启发式判断，不把未检测写成通过。",
      "已检查 llms.txt，只记录有无，不计入红牌或优先整改。"
    ],
    "homepage_challenge": false,
    "homepage_challenge_marker": ""
  },
  "red_card_facts": {
    "R1_CSR_shell": {
      "triggered": false,
      "evidence": {
        "pages": [],
        "reason": ""
      }
    },
    "R2_robots_all_blocked": {
      "triggered": false,
      "evidence": false
    },
    "R3_three_or_more_bots_blocked": {
      "triggered": false,
      "evidence": []
    },
    "R4_no_sitemap_and_few_home_links": {
      "triggered": false,
      "evidence": {
        "sitemap": false,
        "home_internal_links": 11
      }
    },
    "R5_transport_failure": {
      "triggered": false,
      "evidence": {
        "final_url": "https://www.zhiyu.hk/",
        "status": 200,
        "error": ""
      }
    }
  },
  "summary": {
    "home_status": 200,
    "home_internal_links": 11,
    "sitemap_present": false,
    "blocked_ai_bots": [],
    "schema_types": [
      "Answer",
      "Blog",
      "BlogPosting",
      "BreadcrumbList",
      "CollectionPage",
      "DefinedTerm",
      "DefinedTermSet",
      "FAQPage",
      "ImageObject",
      "ItemList",
      "ListItem",
      "Organization",
      "Person",
      "Question",
      "UseAction",
      "WebApplication",
      "WebPage",
      "WebSite"
    ],
    "csr_heuristic": false,
    "llms_txt_present": true,
    "red_cards_triggered": [],
    "scoring_note": "本文件只含客观采集与红牌事实；不设综合分。五维只以清单和缺口表达。"
  },
  "access": {
    "homepage": {
      "url": "https://www.zhiyu.hk/",
      "final_url": "https://www.zhiyu.hk/",
      "status": 200,
      "ok": true,
      "elapsed_ms": 6147,
      "bytes": 58471,
      "encoding": "utf-8",
      "redirects": [],
      "error": ""
    },
    "https_validated_by_request": true,
    "robots": {
      "url": "https://www.zhiyu.hk/robots.txt",
      "status": 200,
      "present": true,
      "error": "",
      "global_root_disallow": false,
      "bot_root_disallow": {
        "GPTBot": false,
        "ChatGPT-User": false,
        "OAI-SearchBot": false,
        "ClaudeBot": false,
        "Claude-SearchBot": false,
        "PerplexityBot": false,
        "Bytespider": false,
        "Google-Extended": false
      },
      "raw_excerpt": "User-Agent: *\nAllow: /\nDisallow: /console/\nDisallow: /api/\n\nSitemap: https://zhiyu.hk/sitemap.xml\n"
    },
    "sitemap": {
      "present": false,
      "url_count": 0,
      "probes": [
        {
          "url": "https://zhiyu.hk/sitemap.xml",
          "status": 200,
          "ok": true,
          "error": ""
        }
      ]
    },
    "llms_txt": {
      "url": "https://www.zhiyu.hk/llms.txt",
      "status": 200,
      "present": true,
      "error": ""
    },
    "ua_probe": {
      "rows": [
        {
          "bot": "GPTBot",
          "page": "首页",
          "url": "https://www.zhiyu.hk/",
          "status": 200,
          "text_characters": 1751,
          "blocked": false,
          "challenge": false,
          "challenge_marker": "",
          "error": ""
        },
        {
          "bot": "GPTBot",
          "page": "内页",
          "url": "https://www.zhiyu.hk/",
          "status": 200,
          "text_characters": 1751,
          "blocked": false,
          "challenge": false,
          "challenge_marker": "",
          "error": ""
        },
        {
          "bot": "ChatGPT-User",
          "page": "首页",
          "url": "https://www.zhiyu.hk/",
          "status": 200,
          "text_characters": 1751,
          "blocked": false,
          "challenge": false,
          "challenge_marker": "",
          "error": ""
        },
        {
          "bot": "ChatGPT-User",
          "page": "内页",
          "url": "https://www.zhiyu.hk/",
          "status": 200,
          "text_characters": 1751,
          "blocked": false,
          "challenge": false,
          "challenge_marker": "",
          "error": ""
        },
        {
          "bot": "OAI-SearchBot",
          "page": "首页",
          "url": "https://www.zhiyu.hk/",
          "status": 200,
          "text_characters": 1751,
          "blocked": false,
          "challenge": false,
          "challenge_marker": "",
          "error": ""
        },
        {
          "bot": "OAI-SearchBot",
          "page": "内页",
          "url": "https://www.zhiyu.hk/",
          "status": 200,
          "text_characters": 1751,
          "blocked": false,
          "challenge": false,
          "challenge_marker": "",
          "error": ""
        },
        {
          "bot": "ClaudeBot",
          "page": "首页",
          "url": "https://www.zhiyu.hk/",
          "status": 200,
          "text_characters": 1751,
          "blocked": false,
          "challenge": false,
          "challenge_marker": "",
          "error": ""
        },
        {
          "bot": "ClaudeBot",
          "page": "内页",
          "url": "https://www.zhiyu.hk/",
          "status": 200,
          "text_characters": 1751,
          "blocked": false,
          "challenge": false,
          "challenge_marker": "",
          "error": ""
        },
        {
          "bot": "Claude-SearchBot",
          "page": "首页",
          "url": "https://www.zhiyu.hk/",
          "status": 200,
          "text_characters": 1751,
          "blocked": false,
          "challenge": false,
          "challenge_marker": "",
          "error": ""
        },
        {
          "bot": "Claude-SearchBot",
          "page": "内页",
          "url": "https://www.zhiyu.hk/",
          "status": 200,
          "text_characters": 1751,
          "blocked": false,
          "challenge": false,
          "challenge_marker": "",
          "error": ""
        },
        {
          "bot": "PerplexityBot",
          "page": "首页",
          "url": "https://www.zhiyu.hk/",
          "status": 200,
          "text_characters": 1751,
          "blocked": false,
          "challenge": false,
          "challenge_marker": "",
          "error": ""
        },
        {
          "bot": "PerplexityBot",
          "page": "内页",
          "url": "https://www.zhiyu.hk/",
          "status": 200,
          "text_characters": 1751,
          "blocked": false,
          "challenge": false,
          "challenge_marker": "",
          "error": ""
        },
        {
          "bot": "Bytespider",
          "page": "首页",
          "url": "https://www.zhiyu.hk/",
          "status": 200,
          "text_characters": 1751,
          "blocked": false,
          "challenge": false,
          "challenge_marker": "",
          "error": ""
        },
        {
          "bot": "Bytespider",
          "page": "内页",
          "url": "https://www.zhiyu.hk/",
          "status": 200,
          "text_characters": 1751,
          "blocked": false,
          "challenge": false,
          "challenge_marker": "",
          "error": ""
        },
        {
          "bot": "Google-Extended",
          "page": "首页",
          "url": "https://www.zhiyu.hk/",
          "status": 200,
          "text_characters": 1751,
          "blocked": false,
          "challenge": false,
          "challenge_marker": "",
          "error": ""
        },
        {
          "bot": "Google-Extended",
          "page": "内页",
          "url": "https://www.zhiyu.hk/",
          "status": 200,
          "text_characters": 1751,
          "blocked": false,
          "challenge": false,
          "challenge_marker": "",
          "error": ""
        }
      ],
      "blocked_bots": [],
      "blocked_bot_count": 0
    }
  },
  "render": {
    "available": false,
    "method": "html_heuristic_v1",
    "reason": "本地一期不做 Playwright 渲染；仅在原始 HTML 上做 CSR 启发式",
    "csr_suspected_pages": []
  },
  "structure": {
    "sampled_ok_pages": 11,
    "schema_types": [
      "Answer",
      "Blog",
      "BlogPosting",
      "BreadcrumbList",
      "CollectionPage",
      "DefinedTerm",
      "DefinedTermSet",
      "FAQPage",
      "ImageObject",
      "ItemList",
      "ListItem",
      "Organization",
      "Person",
      "Question",
      "UseAction",
      "WebApplication",
      "WebPage",
      "WebSite"
    ],
    "schema_type_page_counts": {
      "Organization": 11,
      "WebSite": 11,
      "CollectionPage": 1,
      "ItemList": 1,
      "ListItem": 8,
      "DefinedTerm": 2,
      "DefinedTermSet": 2,
      "Blog": 4,
      "BlogPosting": 4,
      "BreadcrumbList": 7,
      "Answer": 3,
      "FAQPage": 3,
      "Question": 3,
      "UseAction": 3,
      "WebApplication": 3,
      "WebPage": 3,
      "ImageObject": 3,
      "Person": 3
    },
    "pages_with_json_ld": 11,
    "organization_pages": 11,
    "faq_pages": 3,
    "article_pages": 4,
    "breadcrumb_pages": 7
  },
  "content": {
    "sampled_ok_pages": 11,
    "title_duplicates": {},
    "h1_duplicates": {},
    "pages_without_title": 0,
    "pages_without_h1": 10,
    "pages_with_multiple_h1": 0,
    "pages_with_question_headings": 7,
    "pages_with_lists": 4,